,Date,Notes,Commentaires
0,nov. 2024,"3,0",". Viande cuisson mal exécuter...
. Prix normal pour un endroit à la 
   mode 😉
. Service sympa fort jeune...
. 🍷 au top (  carte )
. Cadre sans plus 
. Manque de professionnalisme 
.  Les entrées sont top 

  MARC &  ERIC"
1,nov. 2024,"5,0","Viandes d’excellente qualité, service parfait, excellente ambiance 
Tres franchement, les personnes émettant des avis négatifs sur le prix soi disant élevé n’y connaissent strictement rien aux viandes de qualité, le rapport qualité prix est parfaitement justifié, mais si on prefere un steak frite banal mieux vaut aller ailleurs."
2,nov. 2024,"2,0",Sympa… mais beaucoup trop cher…c’est dommage car le concept de départ était bon mais la faut pas exagérer…on en reviendra pas…
3,nov. 2024,"1,0","Du VOL tout simplement. 

Un gueuleton c’est censé être bien servi me semble t’il. Un os moelle ridicules, sans préparation, trois champignons 29 euro, de qui on se moque ? 

L’addition final fait très mal au portefeuille en revanche j’avais encore fin en sortant. 

C’est scandaleux, tout les prix pourraient largement être divisé par deux"
4,nov. 2024,"3,0","Bonne soirée en globalité mais le manque de transparence sur les tarifs notamment sur toutes les boissons gâche l'expérience et vous laisse un goût amer en fin de repas (c'est dommage parce que ce n'est pas l'objectif ^^).
Sinon, on sent qu'il y a une volonté de faire bien avec de bons produits.
En conclusion, on perd l'esprit de départ qui était de manger bon avec des bons copains, et ça c'est triste. La note est trop salée."
5,sept. 2024,"4,0","Excellente expérience avec des personnels qui connaissent leur sujet. Accueil très sympa et viande succulente.  La carte des vins est impressionnante.
Ils ont même emballé l’os de la côte de boeuf pour notre golden. Top 
Pas donné maïs top."
6,sept. 2024,"1,0","Très petite salle où les tables sont entassées les une sur les autres
La carte est conçue de manière à ne pas voir au final l’addition (prix au kilo de la viande)
Bref hors de prix pour quelques morceaux de viande
Le service est horrible"
7,sept. 2024,"4,0","Restaurant atypique, tant par sa carte que par sa façon de servir. Les plats sont bons et copieux. Le personnel et le service fourni est très bien. Restaurant un peu cher malgré tout."
8,juil. 2024,"4,0","Bel établissement jolie terrasse 
Très bonne cuisine personnel sympa et pro
Concept original qui cache le caractère salé de l’addition et"
9,juil. 2024,"3,0","Le concept est idéal pour les carnassiers, accueil et conseils au top, viande super, mais... seulement 3 étoiles car beaucoup beaucoup trop cher !!! Je comprends bien qu'un bœuf se paye avec les os, mais de là à facturer plein pot, une côte de bœuf pesée avec l´os, NON !!! Dommage !!!"
10,mai 2024,"4,0","Entre ami et en visite à la halles Paul Bocuse, on profite des commerçants et des produits et viens l'heure de partager un petit repas. 
Bonne idée il y a le fameux Geuleton.
En terrasse,  très bien accueilli. 
Mais je me permets de vous faire savoir que la langue sauce gribiche et à l'estragon, ce n'est pas grave mais c'est de la sauce béarnaise du coup.
Sinon plutôt satisfait. 
Je reviendrai dd façon à voir si vous avez apporté une attention à mon commentaire. 
A bientôt "
11,févr. 2024,"5,0","Un très bon moment passé dans ce restaurant !
En plus des conseils avisés de Nicolas en vin, les conseils de Charles en viandes sont juste parfaits !"
12,janv. 2024,"2,0","Nous avons attendu bien trop longtemps pour une quenelle fade et sèche, un poulpe dont je doute qu'il soit fait maison et une addition beaucoup trop salée.
Les clients ne sont que des porte monnaie dans ce restaurant.
Très déçus."
13,févr. 2024,"5,0",Nous avons passé une super soirée ! C’est très bon. L’accueil et le service top. Ambiance sympathique ! On recommande !!
14,févr. 2024,"3,0","Si vous aimez la viande c'est vraiment ""the place to be"". Présentation des pièces crues, cuisson à la perfection, serveurs et serveuse au top que ce soit sur les plats ou pour la sommellerie. Néanmoins, ni les plats sont à tombés par terre, l'addition aussi ! 8€ en moyenne le verre de vin ça commence à taxer. Mais surtout, les prix de la viande est au kilo, on a donc du mal à se rendre compte de ce que cela donne à la fin... nous avons eu une petite amertume quand nous avons payé. Bref, c'était à faire mais je ne pense pas y retourner juste pour ce petit soucis de prix un peu trop haut. Ce qui n'enlève rien à la qualité du service et des plats, une nouvelle fois. "
15,févr. 2024,"5,0","Très très bon. La qualité des produits, les conseils et la gentillesse des serveurs sont au top ! Merci et à très bientôt !"
16,janv. 2024,"5,0","Excellent restau, un très bon moment passé avec un personnel extra ! Je recommande pour des repas entre amis ou en petit comité !"
17,janv. 2024,"1,0","Avec tous ces bons commentaires nous avons souhaité réserver pour un EVG. Après un contact téléphonique chaleureux on me propose d'écrire un mail afin qu'ils puisse me faire une proposition. Jamais de réponse. Je rappelle, on ne sait pas de quoi je parle. On me repropose un mail, sans réponse également. Après 6 téléphones, personne ne savait toujours pas de quoi je parlais, mais on me promet systématiquement une réponse dans les deux jours, puis rien. J'ai abandonné. Dommage, il semble que le succès du restaurant semble laisse au détriment les capacités organisationnelles et la fiabilité. Ce qui est sûr c'est que ce restaurant n'a pas besoin de clients!"
18,déc. 2023,"5,0",Un adresse au top accueil service personnel super chaleureux la nourriture vraiment très très bonne je recommande a 100 pour cent !!!
19,déc. 2023,"5,0","Très belle expérience pour celui qui aime la viande, juste magique, découvertes du Wagyu et d’autres races à viande qui sont exceptionnelles"
20,nov. 2023,"4,0","Tout était excellent, nous avons très bien mangé. Le service était très réactif et agréable, de bon conseil.
L’addition reste tout de même un peu salée."
21,nov. 2023,"2,0","Dommage! Gâteau de foie froid, quenelle compacte et pas aérée. Un peu déçu. Personnel agréable. Mauvaise expérience."
22,nov. 2023,"2,0","L endroit est sympa, mais je pense que tous les clients doivent avoir la même impression désagréable que moi en sortant, celle d avoir été pris pour un pigeon ou un américain...
Personnellement je n y remettrait pas les pieds,  une belle arnaque !!!"
23,nov. 2023,"4,0","Nous sommes allez manger à 3, menu du jour pour moi et un plat pour ma femme et ma fille. 
L'entrée un tartare de maquereau très bon, la viande excellente, j'adore l'idée des garnitures à partager. même les topinambour qui accompagné le plat du jour, excellent. 
Seul bémol, le dessert pas terrible. 
Cela reste quand même un peu chère avec un Plat+dessert du jour deux plas à la cartet, un dessert, un verre de vin, deux café et une bouteille d'eau gazeuse, 104 euros.   
Cela reste une bonne adresse, avec des plats très bons. "
24,nov. 2023,"3,0","Le lieu est sympa, bonne ambiance. 
Les serveurs sont gentils et à l’écoute. 
La viande est bonne. Par contre les accompagnements ne sont pas à la hauteur. 
Et c’est trop cher, vraiment trop cher. 15€ la tranche de pâté croute, 130€ le kilo de côte de bœuf, et les vins … ça fait trop sur la note."
25,nov. 2023,"4,0",Au cœur des Halles. Magnifique joue de bœuf confite accompagnée d'une purée remplie de beurre... Personnel aux petits soins. What else? 
26,sept. 2023,"5,0","Une bière du coin,  un coca,  des rillettes, des os à moelle, 2 T bone de cochon du cantal et un verre de Bourgogne pour un total de 84euros. Je n'avais absolument jamais entendu parler de ce restaurant. 
La viande est extra, les légumes, les pommes grenaille et le service aussi. Tout est très bon,  nous sommes repartis avec un doggy bag pour la rillette. La part était énorme.  Le pain est à l'ancienne et très bon. Deux  bemols, très peu de choix pour les vins au verre et restaurant très bruyant. Mais l'ambiance y est.  J'ai été ravie de découvrir cette enseigne. "
27,sept. 2023,"1,0","Hors de prix 
C’est hors de prix pour une cote de bœuf leur prix au kilo c’est une grosse arnaque on ne sait pas combien ca va couter !
et leur carte des vins les prix sont délirants"
28,août 2023,"3,0",Très bon mais a 90€ par personne sans apéritif ni dessert c’est quand même la moindre de choses. On peut largement manger à qualité égale pour la moitié de ce prix
29,août 2023,"3,0","J’ai fait des dizaines de restos gastro et la, pour la première fois , j’en ai eu pour 100 euros. C’était bon, la viande était bonne mais il y a la même qualité voire mieux à Lyon pour moins cher !!! Bien bien trop cher et les accompagnements ne sont pas à la hauteur ! Ce resto jouit de la réputation de la chaîne et des influenceurs mais il y a bien mieux sur Lyon"
30,juil. 2023,"5,0","Diner prit le soir avant la fermeture estivale 
Tout était excellent des entrées au dessert, idem pour le vin qui avait justement choisi par le sommelier.
Une agréable soirée dans un lieu sans prise de tête ou l'équipe est à votre attention"
31,mai 2023,"3,0","Très bon accueil 
Serveurs gentils et professionnels
Très bonne viande 
Bémol : c’est trop cher même si c’est bon"
32,juil. 2023,"3,0","Très déçu ! 
Rapport qualité prix a revoir 15 euro la tranche de pâté croute (très bonne) ça fait mal , mes ris de veau généreux et bon mais il faut encore rajouter 5 euro pour avoir une purée en accompagnement bref 96 euro pour 1 tranche de paté croute 2 plats 1 purée 2 dessert 2 café 1 bouteille d'eau gazeuse et 1 verre de vin . Ont paye le nom et l'endroit perso je m'attendait a beaucoup mieux . Vincent et Arthur je les suit sur facebook je me faisait une joie de découvrir un resto Gueuleton et bien au final très déçu ,Dommage"
33,juin 2023,"3,0","Très bonne viande mais prix injustifié 
Peu de dessert 
Personnel sympa 
Il vaut mieux manger sa côte de bœuf à la maison………….."
34,juin 2023,"4,0","Endroit très sympathique avec des serveurs très proches des clients et un accueil très travaillé 
La viande ( c est pour cela qu on vient) est bonne - tout le repas s est bien déroulé. 
La note est par contre exagérée ! On mange pour le même prix dans un étoilé. 
Contents  d être venus mais nous ne reviendrons pas à cause du prix. "
35,juin 2023,"4,0","Alors, pour les grands amateurs de très bonne viandes, bref, pour les viandards, c'est ici qu'il faut venir !
La qualité de la viande est exceptionnelle. 
Et il y a du choix. Que ce soit en viande française, mais aussi étrangère.
Le tout servi avec des grenailles (nous on appelle cela des rates) et des légumes braisés, et arrosé d'un bon vin du Domaine Voilot-Guilemard.
J'oubliais, notre choix c'est porté sur une viande bien persillé Allemande : Simmental. Un véritable régal !!!
Un très bon accueil, une très bonne présentation des pièces de bœufs, un jeune sommelier qui a su bien présenter son vin.
Le seul bémol : l'attente entre la commande et l'arrivée du plat !"
36,juin 2023,"4,0","Franchement cela fais depuis longtemps que je désire goûter ce fameux restaurant. Je me suis tout simplement régaler !! Avec des nombreuses découvertes. Le personnel est top, le seul défaut est le prix qui est bien trop élevé.."
37,mai 2023,"1,0","Quelle déception!
Je m'attendais à une expérience intéressante, à la place j'ai eu un repas fadasse a un prix exorbitant !
Etant un amateur de viande, je suis allé au Gueuleton avec l'espoir d'un bon repas.
En retour, j'ai eu des légumes froids, un choix limité de vin au verre, une viande sans intérêt gustatif (Tbone Montbéliarde) malgré un prix élevé (130 euros).
Cerise sur le gâteau, ma maman et moi n'ayant pas la même cuisson, afin de manger ma viande saignante mais chaude, j'ai dû manger pendant que sa viande allait en cuisson. Pendant ce temps, ma mère me regardait manger, puis quand sa viande est arrivée, nous avons échanger nos rôles.
Je ne vous parle pas du bruit qui nous empêchait de nous entendre alors que nous étions l'un en face de l'autre.
 
En résumé, si vous aimez manger froid, cher, avec un choix limité et dans le bruit, alors le Gueuleton est pour vous."
38,mai 2023,"3,0","Très bonne viande 
Accueil agréable et sympathique 
Mauvais rapport qualité prix 
Trop cher
90 euros pour cocktail, côte de bœuf et dessert"
39,mai 2023,"4,0","un"" haut lieu""  pour les amateurs de viande qui est très bien présentée d'ailleurs , mais quand je demande ( je précise je suis un cassssse- pied ) quelle est la durée d'élevage pour le boeuf que nous avons choisi ; la réponse 12 mois comme la viande avec le label rouge que on trouve en grande surface ! Cela me dérange alors que le mieux est entre 24 à 30 mois d'élevage en prairie pour l'engraissement . Bon hormis cela notre viande TIP TOP ainsi que les accompagnements , mais le prix du vin , je trouve pour un Beaujolais tres cher même pour un Fleurie 55 Euros.    "
40,avr. 2023,"5,0","Nous avons testé Le Comptoir Gueuleton aux Halles // Adresse parfaite pour un déjeuner aux Halles. Pensez à réserver ou à venir plus tôt, car le week-end ils font vite le plein. Et c’est mérité ! C’est bon, fait maison et gourmand. Tout ce que l’on attends d’une cuisine bistrotière sans être ringarde. Les saveurs lyonnaises sont là et bien préparées. Et en prime un service efficace et sympathique."
41,avr. 2023,"3,0","Bonne expérience lieu convivial et chaleureux.
Le tarif est trop élevé (équivalent à un restaurant 1 étoile).
Malgré la qualité des viandes, le prix ne se justifie pas."
42,avr. 2023,"5,0","La devanture est simple mais qui laisse voir de belles et bonnes choses. La décoration est dans la lignée de l’esprit du lieu… simple et efficace. L’accueil est respectueux, chaleureux avec des explications claires. Le choix des vins est garanti par un jeune sommelier mais qui connaît parfaitement son sujet mais sans jamais en rajouter (bravo Gabriel !). Quant aux conseils des mets, ils sont très avisés et experts. Arrive le moment tant attendu des services … et là, c’est l’apothéose. Tout ce qui avait été annoncé est au-delà de nos espérances. Côté entrées… pâté en croûte, os à moelles, rillettes et jambon noir de Bigorre exaltent les papilles. Puis vient le moment de l’extase grâce à 2 côtes de bœuf…Croisée (Saône & Loire) et KOD (Danemark). Rarement nous avons eut cette sensation suprême de plaisirs gourmands. Le vin accompagnant ces excellents mets étant en parfait adéquation… il n’en fût que meilleur. Quant aux tarifs, ils sont corrects lorsque l’on regarde la quantité et surtout la Qualité ! Bref, vous l’aurez compris… on pourrait écrire une multitude de choses positives. Une seule pour résumer : excellentissime …"
43,avr. 2023,"5,0",Lieux typique une serveuse très souriante et le repas rien a redire des mets dans la tradition lyonnaise 
44,avr. 2023,"5,0","Un super moment, l'accueil ainsi que le service est super, de bons conseils et personnel très agréable. Le repas était un plaisir du début à la fin l'expérience vaut le détour 😁"
45,mars 2023,"2,0","150€Kg la côte de boeuf... 35€ chez mon boucher. Si vous en avez déjà grillé au BBQ, on sait qu'ils ont trouvé des bons pigeons bobo Lyonnais. Excellent marketing, mais personnellement je ne reviendrai jamais :-) "
46,févr. 2023,"5,0","C’est bon !!!!!! On est venus 2 fois et on reviendra ! La qualité est présentes sur tout ce que j’ai goûté et on a déjà goûté pratiquement tout ! 

Seul petit hic, la carte des vins sur téléphone, ce n’est pas agréable à lire et le support n’est pas le bon, autant pour la carte et le menu oui mais c’est tellement plus agréable de lire une vraie carte des vins, surtout pour la qualité des bouteilles proposées."
47,févr. 2023,"4,0","Dîner entre amis. Une carte simple,mais on vient pour y manger du bœuf (ou du cochon auvergnat) . La viande était excellente, bien persillée et différentes cuissons. Nous avons fini avec petite liqueur de citron !"
48,févr. 2023,"5,0","J’ai tout aimé nous avons pris 8 petite entrée à partager tout était très bon. En viande on a pris la tarentaise qui était très bonne la cuisson est maîtrisée a la perfection. On a pris aussi la jersey beaucoup plus de goût que la première et bien évidemment plus cher. Les pommes de terre grenailles en accompagnement avec un saladier de légumes croquant très bien assorti avec la viande. Ma foi, j’ai appris à payer cher la qualité. Il faut savoir ce que l’on veut. C’est vrai que ce n’est pas accessible à tout le monde. Mais j’y retournerai bien évidemment, a l’occasion."
49,févr. 2023,"5,0",Nous avons réservé dans cet établissement dans Les Halles Paul Bocusse vraiment très bien un personnel plus qu’au top à l’écoute serviable de bon conseil des assiettes très bien garnies puis tout ça dans un lieu incontournable de Lyon merci pour votre professionnalisme.
50,janv. 2023,"4,0",Rien a dire . Produits exceptionnels et personnel au top. Vois voulez vous encanailler?? C'est l'endroit pour. Super viande et super vin. Bravo.
51,janv. 2023,"5,0","Rapport qualité prix irréprochable 

Peszonnel  souriant et agréable qui connais parfaitement ses produits 

Il nous manquer la sauce le chef de salle à couru immédiatement la chercher il l à remarquer de lui même 

Bref tout et parfait 

Bonne ambiance gueleton comme on les aime avec des produits parfaitement maîtriser et cuit "
52,janv. 2023,"4,0","C'est trop cher mais c'est très très bon.
Restaurant de viande, qu'ils savent très bien cuire, une magnifique carte des vins, une salle très chaleureuse. Pour nous l'accueil a été très attentionné. "
53,déc. 2022,"5,0","On m’a fais découvrir ce concept d’un bon gueuleton entre amis et c’est vraiment top!
Produit de qualité, service au top,de qualité partout dans ce restaurant.
Merci pour ce moment"
54,déc. 2022,"5,0","Nous sommes venus à 3 entre collègues, dans l'optique de se faire plaisir sans limite, on s'est régalé et on s'est éclaté (littéralement) en mangeant tous ces plats, c'était magnifique.
Ça vaut largement son prix ! "
55,déc. 2022,"2,0","Vraiment déçu… L’esprit gueuleton que nous sommes venus chercher, n’y était pas du tout… !
 Pas de carte ! une fois que l’on a téléchargé la carte sur son téléphone la composition est simple, quelques entrées à partager de type tapas et ensuite côte de bœuf ou côte de bœuf. Une carte des vins au verre avec seulement trois références
Des côtes de bœuf vendu mâturet , mais pas du tout ! 
Cuisson saignante respecter, mais cuit à la plancha et complètement brûler à l’extérieur. On s’attend quand même en venant ici à des cuissons feu de bois.
Des tarifs exorbitants est nullement justifié des côte de bœuf de 100 € à 4 50 € complètement hallucinant
Une foi de plus l’esprit gueuleton y est vraiment pas

Pour un couple, trois petites entrées à partager, une, côte de bœuf, soi-disant Maturet, deux verres de vin chacun et un café 190 € …"
56,oct. 2022,"5,0","Première fois entre copines dans ce restaurant de bons vivants.
Service très agréable, viande incroyable et vin rouge bien conseillé. 
Je reviendrai"
57,oct. 2022,"4,0","Accueil chaleureux , carte qui met l’eau à la bouche, décoration des plus chaleureuses,… le cadre est posé pour faire un bon gueuleton ! 

Les serveurs sont agréables et on a l’air d’être entre potes pour partager un bon moment ! 

Nous avons laissé le choix pour le vin avec un budget définit pour chaque bouteille , parfait ! 

Le pâté croûte et la terrine de cochon au poivre vert sont délicieux et des plus gourmands  ! 

On reviendra pour manger une bonne viande rouge ! 
Compter un budget de plus de 100€ par tête, tout de même pour goûter a la bonne chair et au bon vin."
58,oct. 2022,"4,0","Une très belle soirée entre amis dans un beau cadre, avec un service au top et de belles viandes.
Le concept rend ce lieu convivial mais c’est surtout son équipe : souriant, disponible, dynamique, de bon conseil !"
59,oct. 2022,"4,0","J'aime beaucoup malgré le prix assez élevé. Ce qui est dommage c'est qu'il n'y a pas assez de quantité dans les entrés à partager. 
Mais j'aime bien surtout l'ambiance très chaleureuse."
60,sept. 2022,"4,0","Cadre chaleureux et sympathique accueil dans ce restaurant (de chaîne ?) spécialisé dans la viande.
La cote de bœuf servie (variété abondance) était vraiment excellente et parfaitement cuite; les petits légumes et pommes grenailles qui l’accompagnaient étaient également très bons.
Les portions de viandes sont facturées au poids ce qui peut rapidement chiffrer selon le morceau choisi !
Petit bémol : bien que très sympa, le serveur pousse un peu beaucoup pour faire monter l’addition (sur les entrées, le vin, les desserts et enfin les digestifs…) ; cela fait à la fin un peu lourd !"
61,sept. 2022,"4,0","Très bon accueil et service.
Viandes excellentes, fondantes. 
Petits légumes et pommes de terre délicieux.
Entrées également très bonnes : nous avons goûté l’os à moelle, le pâté et le jambon qui est à tomber. Même le pain est bon.
Le seul bémol, le prix mais la qualité est bien la.
A découvrir absolument en sachant qu’il faudra prévoir le budget."
62,sept. 2022,"3,0","Personnel sympa mais rapport qualité / prix pas au RDV. L'ensemble est bon, bien servi mais on termine très facilement à plus de 100€ par personne et à ce prix là on peut faire un étoilé."
63,août 2022,"2,0","Très déçu car aux vues des vidéos, je m’attendais à un vrai « concept »… a une convivialité de ouf’, à discuter avec les autres convives, à se partager des plats (comme à « La cave de l’os a moelle » à Paris pour ceux qui connaissent), etc…
Il n’en est rien, c’est un resto au concept tout à fait traditi et…
… j’ai trouvé très très cher.
La qualité est là mais… à ce prix là il ne manquerai plus que ça j’ai envie de dire..!
Le personnel est hyper sympa, plutôt convivial, argumentent bien leurs produits, etc… mais quand la note arrive on se demande s’il n’y a pas trop de marketing du coup.
J’ai hâte d’en essayer d’autres afin de pouvoir comparer (peut dans de plus petites villes)…"
64,juil. 2022,"5,0","Repéré sur les réseaux sociaux, ce restaurant est une invitation à la bonne bouffe. Tout est réussi et se marie parfaitement avec le cadre et la bonne humeur des serveurs. Je recommande de prendre plusieurs entrées qui sont meilleures les unes que les autres. La viande affinée est une explosion de saveur en bouche. Pour autant, pensez à donner votre cuisson si vous n’aimez pas la viande saignante voir bleue. Nous nous sommes régalés de bières et de vin avec notamment un sommelier de tres bons conseils.
Pour ce qui est du prix, prévoyez un bon 80-100€ par personne si vous voulez vivre l’expérience au maximum."
65,juin 2022,"4,0","Très bonne expérience, les viandes sont de très bonne qualité et bien cuites. Nous avons passé un excellent moment chez gueuleton merci."
66,juin 2022,"2,0","Viande très bonne mais le concept ne m'a pas convaincu. Volonté de vous faire dépenser.100 € pour 2 pour 2 entrées 750g de côte de bœuf et 2 verre de vin.
Je ne reviendrai pas malgré une qualité exceptionnelle de la viande. Trop de chi chi. Excessivement bruyant."
67,mai 2022,"5,0","Accueil et service parfait. De l’entrée au dessert tout est bon. Le jambon noir de bigord excellent puis bien conseillé nous avons opté pour une cote de bœuf tarentaise maturée 60j qui était une tuerie. Le dessert à la fraise juste parfait. Le pic St Loup s’accordait bien. 
Tarif un peu élevé justifié au vu de la qualité des produits. 
Bref une très très bonne adresse."
68,mai 2022,"3,0","Nous savions où nous allions. Nous voulions essayer. C'est fait. Le service était plutôt agréable, même s'il a fallut demander à plusieurs reprises de l'eau ou du pain. Les entrées sont bonnes. Les côtes de bœuf aussi. L'accompagnement de petits légumes très bien cuisiné. Quid des petites patates qui baignent dans le gras? Un rapport qualité prix excessif ! Nous ne reviendrons pas. "
69,avr. 2022,"5,0","Réussis à réserver une table pour 3, on ne regrette pas du tout l'attente pour avoir de la place ! 
Serveurs au top, la viande vraiment vraiment de très bonne qualité on s'est régalé. Le prix est assez élevé mais tout est de très bonne qualité que ça soit les entrées à partager, le vin ou la viande. Rien à dire mis à part à faire absolument :)"
70,avr. 2022,"3,0","Le repas est bon mais les tarifs sont prohibitifs par rapport à la qualité des produits proposés. Une côte de boeuf à 140€ pour deux qu'on trouvera meilleure ou moins chère chez des spécialistes de la viande sur lyon. (Butcher ou Argot) Service très long qui plus est et bien loin de l'image véhiculée par ""Gueuleton"". Plus resto à bobo que bons vivants. Déçu."
71,mars 2022,"5,0","Alors, après être abonnée à la revue. vue un milliard de vidéo gueleton !!!
Et bien j y suis allée,  très belle déco, normale c est le concept. repas excellent,  des légumes à tomber, viande au top du top. 
Déçu par le service, long.  gueleton, c est !!! à l attaque,  apero urgent, vins urgent ok"
