,Date,Notes,Commentaires
0,nov. 2024,"5,0","Deux fois en un mois que je viens déjeuner dans cet établissement. Cuisine de qualité, prix abordable, bonne humeur de la serveuse. De plus, les chèques vacances sont acceptés ; ce qui n’est plus le cas dans beaucoup d’établissement. Au plaisir de revenir."
1,sept. 2024,"5,0","Le hasard nous a conduit à cette adresse 
L’accueil y est parfait, le repas excellent 
un petit bonheur en plus !!la patronne très souriante fredonne entre ses tables , tellement agréable de rencontrer quelqu’un heureux de son travail 
Merci pour cet agréable moment"
2,juin 2023,"4,0","Les plats sont copieux et bons. Le service est rapide et agréable.
La décoration intérieure est très belle et la terrasse est appréciable lorsque l'ont veut manger à l'extérieur.

Les prix sont abordables et cohérents avec la qualité des produits"
3,oct. 2024,"5,0","Nous sommes passés manger un morceau après avoir exploré le parc de la Tête d’Or. Nous avons apprécié qu'ils étaient ouverts à 15 heures (heures 7 heures - minutes) . J'ai bu une tarte à l'oignon et un verre de vin. Mon mari avait le poulet avec des champignons et des pommes de terre et un verre de bière. Les deux repas étaient excellents! La femme qui nous a aidés était très arrangeant et nous a donné un excellent service. Elle ne parlait pas beaucoup anglais, mais avec le petit peu de français, je savais que nous étions capables de communiquer. Je recommande vivement si vous êtes dans la région!"
