,Date,Notes,Commentaires
143,févr. 2016,"2,0","Une première expérience en demie-teinte de ce petit restaurant qui aurait tout pour plaire mais qui finalement déçoit.
L'ambiance générale est plutôt sympa, le coté ""bistrot"" est respecté. Là où le bât blesse c'est les plats, qui sont loin de faire l'unanimité dans notre groupe d'amis. S'il ne sont pas mauvais, ils n'en reste pas moins insatisfaisants. Idem pour les desserts, nos avis sont très mitigés d'une assiette à l'autre...
Dernier mauvais point, la plupart des vins que nous aurions souhaité gouter étaient en rupture...

En conclusion, nous ne renouvellerons pas l'expérience. Dommage !"
144,mars 2016,"2,0","Que de chemin parcouru depuis l'ouverture de 2013, sans être un habitué j'ai fréquenté plusieurs fois cet établissement et je ne peux que constater que le chemin parcouru est impressionnant , dommage que ce soit en marche arrière: cuisine, service, propreté, tout part à vau-l'eau. Cette expérience sera la dernière."
145,mars 2016,"1,0","Troisième visite dans ce restaurant en 18 mois, plus par commodité que par envie.
La première, impression correcte avec un service très agréable, deuxième fois plus mitigée, et cette troisième fois qui sera la dernière.
Entrée salade avec crosquinis de chèvre : comprendre salade sous sachet, vinaigrette industrielle, petit chèvre pané de la grande distribution.
Plat : Dos de cabillaud sur lit d'oignons rouge, peu de saveurss
Accompagnement : plus de légumes un samedi soir à 20h, on vous propose donc salade ( et oui la même que l'entrée moins le chèvre) et pommes de terre sautées dignes de la cantine scolaire.
Dessert tarte du jour banane chocolat : fond de tarte, ganache au chocolat ( faite maison ?), et rondelles de banane crue dessus joliment disposées et saupoudrées de cacao, jolie mais décevante ...
Service par contre gentil et agréable.
Ce restaurant manque cruellement d'un véritable cuisinier."
146,févr. 2016,"5,0",Très bon resto des produits frais (une carte réduite cela ne trompe pas) je peux que recommander vous avez la possibilité de réserver via la fourchette afin de vous faire plaisir à moindre prix !
147,févr. 2016,"1,0","Tout heureux de venir dans un restaurant avec de bons avis, nous avions pris escargots à la crème de cèpes et andouillette bobosse. Les escargots avaient du trainer dans un bouillon sans être totalement immergés: ils étaient secs à moitié, comme s'ils avaient été gratinés, sauf que la crème de cèpes ne l'était pas (conclusion: ils avaient séché quelque part). L'andouillette bobosse rien à dire, si ce n'est son accompagnement: un peu de moutarde à l'ancienne basique dans un petit ramequin et pour moi un autre ramequin de légumes (les légumes étaient froids.. le temps de les faire réchauffer, l'andouillette était froide) pour mon mari un ramequin de dés de pommes de terre rissolées bien huileuses. Rien qu'à les voir je n'avais aucune envie de les gouter. Nous avons pris une bouteille de vin (rajouter au moins 23 euros) qui n'était pas exceptionnel (rares sont les fois où nous ne finissons pas la bouteille à deux... et bien là, nous n'avons pas été plus loin que la moitié). Bref nous somme parti sans prendre de dessert tellement nous étions déçus par l'ensemble. Déco de cantine, cuisine ouverte, merci les odeurs sur les vêtements. A noter: un petit ramequin de purée de vitelotte en mise en bouche correct. 
Service extrêmement rapide. En deux temps trois mouvements nous avions fini et étions déjà dehors. Vraiment je ne le recommande pas."
148,févr. 2016,"4,0","Nous sommes allés au restaurant en amoureux; Le cadre fraichement rénové est plaisant, et les assiettes de qualité. La situation n'est pas très pratique car un petit peu éloignée des transports en commun (15 minutes à pied du métro Monplaisir)"
149,janv. 2016,"5,0","Cherchant un restaurant dans le huitième, pas très loin de la faculté de médecine, nous avons choisi cet endroit selon les avis de plusieurs sites d'internautes. Le repas a été un réel moment de plaisir, avec trois formules entrées plat et dessert. Les tartares de poisson et de bœuf bien préparés et assaisonnés. Les patates servies en accompagnement excellentes. Desserts succulents. Nous reviendrons dans cette boutique qui ne paye pas de mine lorsque l'on entre. "
150,janv. 2016,"3,0","Un petit Resto sympa ou on aime diner. Les prix son corrects, le service très agréable et la cuisines simple mais efficace !"
151,janv. 2016,"4,0","service agréable. bonne carte
la cuisine est séparé uniquement de la salle par un ""bar"" qui sert de passe plat

pas déçu j'y retournerai
repas pris le 7 janvier midi"
152,janv. 2016,"4,0","réservé pour le 1er janvier 2016, pour 12 personnes, pas évident..ne connaissant pas donc choisi à la base ""par élimination""...paie pas de mine au premier abord...supers bien reçus malgré salle bondée de 43 autres personnes...le serveur vraiment adorable (même si un coté tète en l'air lol), le patron (ou le responsable) adorable, de bon conseil, présent et attentionné...
et puis viennent les plats. Alors là sincèrement des mets dé-li-cieux !! que ce soit la cuisse de canard, le poisson,. Le veau ou autre....moelleux, fondant, cuit à point. Vraiment rien à dire pour une note très correcte pour 12...

alors oui c'est parfois un peu bruyant certes, mais oubliez pas le nom ""esprit bistrot"" et non ""esprit cloitre""...normal  donc..

bref allez y sans hésiter et laissez vous surprendre...."
153,janv. 2016,"4,0",Menu et carte intéressants par la variété et le coût tout  fait abordable avec esprit brasserie. Déco moderne et sobre. Cuisine ouverte sur la salle. Plats goûteux et bien présentés. Parking pas trop aisé à proximité en soirée
154,août 2015,"4,0","Nous y avons mangé plusieurs fois, midi ou soir, et nous avons toujours été bien accueillis.
La cuisine est bonne et le budget n'est pas assomé.
Cuisine de bistrot oui, mais travaillée.
Carte des vins correcte.
Petit plus pour la carte et ses commentaires qui vous mettent le sourire avant même l'arrivée des plats.
A faire!"
155,oct. 2015,"4,0","Ce restaurant propose des plats avec un rapport qualité prix plus que correct.
Les saveurs étaient au rendez vous, et un contexte sympathique pour partager un dîner.
Petit bémol en ce qui concerne le service, dommage."
156,oct. 2015,"5,0","Cuisine sympa et créative, prix pas excessif. Nous avons été bien accueilli et bien servi. Nous reviendrons."
157,sept. 2015,"3,0","L'intitulé des menus fait très envie cependant le contenu des assiettes est relativement insipide. Donc, nous avons trouvé les prix pratiqués pompeux par rapport à la prestation. D'autant plus que le serveur était vite dépassé, bref, un bof très général !"
158,oct. 2015,"3,0","Nous avons testé aujourd'hui le brunch de l'esprit bistrot à Garibaldi, le brunch à 25€ n'est pas rentable, très chère pour la quantité de nourriture proposée. Petite faim vous abstenir. Pas de boisson chaude proposée!
La formule à 20€ est bien, viennoiseries chaudes, confitures maisons et salades fraiches. Les oeufs brouillés cependant ressemblent plus à une omelette trempée dans du lait."
159,sept. 2015,"3,0","J'ai testé pour la première fois ce restaurant à Momplaisir en juillet. Nous avons bien mangé, le cadre est sympa et l'équipe souriante. Mais ma 2ème visite n'avait rien à voir en septembre !!!! le serveur n'était pas le même et moins souriant, quant au repas mon dieu !!! j'ai pris une pièce de boeuf que je n'ai pas pu mangé, beaucoup trop cuite, de la semelle, quant à la fraicheur de la viande j'ai des doutes...Lorsque le serveur m'a demandé si tout c'était bien passé, je lui ai dit ce qu'il en était, et est reparti san un mot !!! il m'a redemandé la même chose lors du paiement (avait déjà oublié) et bien que je lui ai redit gentiment ma déception, il est resté de marbre...un geste commercial aurait été la moindre des choses. Peut-être une 3ème fois ..."
160,sept. 2015,"4,0","Pour un dîner entre ami, un soir de semaine
Déco style brasserie sympathique, le vin au pot n'est pas une piquette mais quelques petits ratés niveau cuisson des ravioles et sauce au poivre du magret peu de goût... Dommage, sinon les assiettes sont bien présentés, la qualité de la viande bonne... Le service est sympa ni trop long ni trop court...
On s'en sort pour un prix moyen le soir de 27-35€
Le + : Toutes les viandes au même prix, choix du poids supérieur moyennant 5€ de +."
161,sept. 2015,"4,0","Nous avons dîner trois fois dans ce restaurant et nous n'avons jamais été déçu. 
Le rapport qualité/prix est bon, les plats sont bien présentés et bons. 
Le personnel est sympathique. 

Nous recommandons."
162,juil. 2015,"3,0","En entrée, j'ai pris un gaspacho très fade et pas assez froid suivi d'un Parmentier de lieu noir sans assaisonnement  qui ne m'a pas étranglé. Je ressors de ce restaurant l'estomac léger pour 15€ tout de même, c'est cher pour un plat du jour et entrée !!!"
163,juil. 2015,"3,0","Ce qu'il y a dans les assiettes est frais et bon. 
Par contre service trop long, rosé trop chaud et carte des vins pas très connue du serveur. 
"
164,mai 2015,"5,0","Une belle découverte, des produits frais de qualité, une cuisine ouverte qui permet de voir le chef à l'œuvre, un accueil sympa, la possibilité de voir les ""coulisses"" c'est déjà important mais quand en plus le personnel est souriant, la cuisine innovante et succulente, c'est juste parfait!"
165,NA,"4,0","Nous avons découvert ce restaurant proche de chez nous pour la première fois et nous y retournerons. 
La carte propose des produits frais, de saison et de qualité...rien a voir avec ce qu'on trouve sur la place Ambroise courtois au même prix (sûrement du surgelé). 
Le service est très pro et rapide. 
Je vous recommande le vacherin a la vanille! 
Très bon moment pour un anniversaire a 2. "
166,NA,"5,0","Belle découverte, des produits frais simples et parfaitement cuisinés. Le cadre est un peu basique mais dans l'assiette on se fait plaisir et les prix sont plutôt bas. "
167,NA,"2,0","Une cuisine traditionnelle avec des produits frais mais manger dans le froid des plats froids que l on demande de réchauffer et qui sont encore froids c est compliqué, dommage!!enfin le vin rouge laisse un goût en bouche.
Pour finir la corbeille de pain avec une tranche par personne c est un peu juste!!!DOMMAGE"
168,NA,"3,0","Déçu tant par la nourriture que pour le service.
En entrée salade lyonnaise avec oeuf mollet ,rien de transcendant mais l'oeuf était bien cuit et les croûtons croustillants.
Plat du jour, rouelle de porc avec à mon sens un manque de cuisson ,accompagné d'un gratin de macaroni bien trop cuit et non salé.
Quand au dessert je l'attend toujours.
Personnel sympathique mais bien peu nombreux en rapport de l'influence du midi."
169,janv. 2015,"4,0","Pas toujours évident de trouver un endroit correct pour se restaurer un vendredi entre nouvel an et le week-end qui suit. L'Esprit Bistrot répond cependant présent.

Au chapitre des regrets, il y a la température de la salle car il faisait franchement frisquet ce jour-là (je ne sais pas si c'est habituel ou non) ainsi que l'attente un poil longue avant que les plats soient servis.

Tout le reste est positif : personnel très aimable, cuisine excellente (filets mignon et pommes de terre sautées), desserts succulents (mousse de marron) et tout fait maison avec des fournisseurs locaux et note très peu salée.

Je recommande chaudement cet établissement, mais peut-être attendre qu'il fasse meilleur dehors, notamment pour profiter de la terrasse..."
170,déc. 2014,"1,0","Croute de cèpes cramée, ravioles brûlés, vin non disponible, menu surévalué, patron hypocrite prétendant offrir le café et le digestif mais les facturant sans vergogne !"
171,NA,"3,0","Essayé sur recommandation d'amis mais pendant le weekend de la fête des lumières pas de chance il n'y a que deux menus pour le choix on repassera 
A essayer un autre jour pour confirmer ou non cette impression mitigé"
172,nov. 2014,"4,0","Ambiance conviviale et simple. Cuisine plutôt recherchée et de qualité pour un ""bistrot"". Le commentaire parlant de produits avariés me surprend, nous avons diné plusieurs fois dans ce restaurant toujours avec le même plaisir et en profitant de bons produits.
Prix raisonnables.
Une adresse à découvrir... dans le quartier Monplaisir mais un peu en retrait de la partie très ""touristique""."
173,nov. 2014,"4,0","Le personnel a été accueillant, sympathique et a notre écoute pendant le repas. La cuisine était bonne et les assiettes bien remplie.L'ambiance du bistrot est chaleureuse et calme. Les prix sont raisonnables. ""Nul ne peut être parfait, mais presque"".
En résumé: ce bistrot est à tenter !!!!!"
174,oct. 2014,"1,0","Une expérience redoutable à midi... Mon amie et moi avons commandé 2 plats du jours (poulet). A un mètre de la table l'odeur était déjà redoutable. Manifestement la viande était avariée (confirmé par table d'à-côté). Comment la cuisine ne s'en est-elle pas aperçue ???  Proposition de remplacement par le poisson de la carte : saumon. Arrive pas cuit, et surtout franchement pas bon, accompagné de pommes de terres frites réchauffées et grasses.  Le café gourmand : la mousse soit disant au fruits avait une odeur et un goût de fromage...  Bref, que dire de plus ?"
175,août 2014,"4,0","Ici on mise sur les produits frais et régionaux, tout est fait sur place, un peu excentré par rapport au quartier de Montplaisir, mais au calme, et on peut aussi manger en terrasse.
Accueil adorable, nous sommes venus avec une personne en fauteuil électrique, on nous attendait, l'accès était préparé, et le service a été charmant tout au long du diner. Nous avons bien aimé le tartare de bœuf coupé au couteau, servi avec de délicieuses pommes de terre rôties, les desserts excellents également. Le bémol: la planche d'antipasti à 20€, ça c'est trop cher, même si les tapenades étaient bonnes!
En bref une adresse que je recommande vivement!"
176,sept. 2014,"3,0","Nous avons mangé entre collègues en terrasse. Le lieu est sympathique, excentré du bruit de la place des frères lumière. La cuisine est bonne notamment les salades (plat) et les ravioles. Par contre, les desserts sont très décevants : l'assiette de fromage se compose de trois petits fromages, le fondant au chocolat n'est pas bon (ni fondant, ni chaud). Les serveurs ne sont pas très sympathiques et ne connaissent pas biens leurs plats ! 
à tester un midi mais il y a d'autres restaurants à Montplaisir plus sympas."
177,août 2014,"4,0","J'ai bien mangé et rapidement, que dire de plus ? La cuisine semble maison les plats sont simples, copieux et équilibrés, le service est agréable.
La petite place sur laquelle est la terrasse est relativement calme on peut y manger au soleil comme à l'ombre.
On ne regrette pas du tout ""Le Berchet"" pour la restauration du quartier."
178,NA,"4,0","Un resto lyonnais pas cher avec
avec des produits des artisans lyonnais, donnant sur une impasse tranquille, avec une serveuse sympathique. Vraiment très bien"
179,mars 2014,"4,0","Nous ne connaissions  pas et, de passage, sommes tombés dessus par hasard. Nous avons passé une agréable soirée : Cela semble frais, c'est bon et à prix très doux (une quinzaine d'euros le plat, cinq euros les desserts)"
180,févr. 2014,"4,0","Bonne surprise que l'ouverture de ce petit bistrot dans le quartier de Monplaisir.
La cuisine est fraiche (c'est sûr) et le type est classique (ce n'est pas un bouchon, étrange qu'un personne émette ici une critique sur les spécialités lyonnaise, alors que ce n'est pas le but !!)
En tout les plats sont bien exécutés, et on se régale !
Sélection de vins assez sympa et tout est possible au verre, ce qui permet de prendre un vin différent avec chaque plat.
Ambiance épurée, cuisine ouverte. Assurément une adresse à recommander !"
181,NA,"5,0","Première visite ici sur une recommandation de ma belle soeur. Premier point positif: on peut facilement se garer. La commande est prise rapidement et arrivent l'entrée, des oeufs meurette servis dans une terrine en verre.
En plat du jour, un rôti de veau accompagné d'un gratin de pâtes qui se laisse facilement manger. Comme dessert, je m'oriente vers le sablé breton et sa mousse de marron: je ne suis pas déçu car le sablé comme la mousse sont excellents. 
Le personnel est prévenant et efficace. 
Un endroit où je reviendrai très bientôt avec des stagiaires. 
Un seul bémol: un peu plus de chauffage et ce sera parfait."
182,nov. 2013,"1,0","Décevant. On voulait faire un bistrot typiquement lyonnais avec de la famille de passage, et on a trouvé ça très banal. Le service était hautin et froid. La cuisine prétendue ""fraîche"", on émet des doutes. On serait aller n'importe où ailleurs, on aurait pas fait de différence. Conclusion, on a déçu nos invités qui n'ont pas apprécié. Une adresse à ne pas recommander."
183,sept. 2013,"5,0","Un accueil chaleureux, des plats copieux et succulents. Cuisson de la viande parfaite. Un service tout en sourire et de bons conseils. Le coteaux du lyonnais en rouge très bon. Adresse à decouvrir!"
184,sept. 2013,"4,0","Ouvert le 3 septembre, et testé dans la foulée....
Très bonne adresse.
Patrons passionnés, cuisine de grande qualité avec des produits frais. Un tartare aux 3 poissons façon italienne....a 18€ entrées et desserts à 5€, rien à redire en terme de rapport qualité prix. Le vin à 22€ de bonne facture.
Restez cet établissement, vous ne serez pas déçus"
