,Date,Notes,Commentaires
75,janv. 2018,"4,0",Un endroit simple d'accès et un cadre sobre qui offre une sensation de bien être. D'autant que le personnel est resté très avenant. Un restaurant qui mérite d'être testé; vous y reviendrez certainement.
76,déc. 2017,"5,0","Beaucoup de restos sympa pour déjeuner dans le quartier mais celui-ci est spécial. C'est celui où l'on va quand on a envie de très bien manger, de se poser, de lâcher un peu la journée de boulot, et d'être particulièrement bien accueilli. Le service orchestré d'une main de ""chef""... est particulièrement charmant."
77,déc. 2017,"5,0","Nous avons mangé à deux en semaine avec une réservation La Fourchette 
L'accueil fut parfait : le serveur charmant et à l'écoute 
Nous avons aimé le flan de carotte et son coulis de poivron en apéro
Nous avions prévu de prendre un plat et un dessert mais une entrée nous a fait fortement envie
Le serveur a accepté que nous la prenions à deux :les os à moelle étaient parfait !!
Les plats furent tout aussi bon
Seul bémol la mousse au chocolat trop sucré 
Mais dans l'ensemble nous avons vraiment bien aimé le repas 
À essayer sans tarder"
78,déc. 2017,"3,0","Très bon accueil, foie gras délicieux mais pour la suite gratin de ravioles très gratiné et raplapla, tartare avec assaisonnement étrange mais ardoise correct de poisson.
A refaire pour confirmation car il nous a semblé qu'il y avait eu un problème en cours de service"
79,nov. 2017,"4,0","Un repas en sortie de réunion. Nous avons été vite servis dans un cadre et une ambiance sympathiques. Les plats servis étaient bons et bien présentés, les produits frais.... J'aurais apprécié un peu plus de légumes mais je suis un gros mangeur...
Tarte praline succulente en dessert et, au moment de l'addition les cafés nous ont été offerts... C'est le 2eme que je teste de cette petite chaine ... plutot sympa!"
80,mars 2017,"4,0","Cuisine semi gastronomique, c’était la troisièmes fois que j’ai mangé à ce restaurant. À recommander "
81,nov. 2017,"4,0","Plats de qualité servis rapidement, ambiance bistrot, service aimable et à l’écoute.
Mention spéciale pour les boissons (vin et bière).
Entrée : œufs pochés façon meurette (très bon).
Plats : Quenelles.
Dessert : mousse au chocolat"
82,nov. 2017,"4,0","Le restaurant faIt parti d'une petite chaîne,  il y en a 2 autres comme celui ci situés ailleurs. Il est un peu excentré de la place monplaisir. Les serveurs étaient très sympas. C'est plutôt conviviale. La cuisine est fraîche et c'est bon !!"
83,nov. 2017,"5,0","Très bonne cuisine un très bon rapport qualité prix
Des recettes originales et goûteuse et un accueil très sympa"
84,oct. 2017,"4,0",Très bon rapport qualité prix pour une cuisine maison et de saison. Service rapide et agréable. Excellente adresse pour un déjeuner entre amis: à  refaire!
85,oct. 2017,"1,0","Venue en groupe, ensemble très décevant, cuisine sans saveur, longue attente 
Un tajine qui n'avait de tajine que le nom (citrons confits, on les cherche encore) un osso bucco qui fait penser à une cote de porc, côté cuisson pas de respect des demandes.
Bref passez votre tour et allez voir un  vrai bouchon ..."
86,oct. 2017,"3,0",Très bon accueil et serveuse très rapide ! Jolie présentation des plats. Par contre on entend toute là conversation des hommes en cuisine. J'ai pris un tartare de bœuf et mon copain un gratin de raviole. La viande n'était pas tendre voire un peu dure et la ratatouille juste tiède. Les ravioles étaient un peu trop cuites. On a voulu tester et nous faire notre propre avis: mitigé !
87,oct. 2017,"5,0","Un grand merci au chef Herve et à son équipe .Des plats bien garnis nous avons était très bien servi avec une  hotesse très souriante .
Je reviendrais sans hésitation. "
88,août 2017,"1,0","les repas sont arrivés tièdes, une cuisse de canard crue et un burger avec une viande douteuse, le service très moyen et désinvolte!"
89,juil. 2017,"1,0","Longue attente des plats. Les serveurs ne communiquent pas avec la cuisine ce qui fait que lorsque vous commandez un hamburger, la serveuse revient finalement un quart d'heure plus tard pour vous expliquer qu'il n'y a plus de steak haché pour faire le hamburger. Du coup vous re-commandez à nouveau un nouveau plat : des pâtes avec des légumes (14 euros quand même). Au final, ce plat tant attendu arrive tiède, pas assez salé - à mon goût - et peu garni. Lorsque vous demandez s'ils ont du parmesan  ou ne serait-ce que du gruyère, on vous rétorque qu'ils n'en n'ont pas ou plus non plus. Enfin, attention à l'erreur sur la carte des desserts : le fondant au chocolat qui vous est proposé est en réalité un moelleux au chocolat. Bref, c'est un restaurant qui m'a semblé désorganisé, cher et prétentieux."
90,juil. 2017,"1,0","Nous étions venus pour un repas entre amis, et nombreux ont été déçus... Les plats sont chers, plusieurs plats n'étaient pas disponible, la cuisson des viandes ne convenait pas... L'attente était longue et les portions limitées."
91,juil. 2017,"3,0","Éts agréable, bon accueil. en ce qui concerne les mets c 'est un peu décevant; les pommes de terre, coupées irrégulièrement, étaient donc pour certaines , pas assez cuites, c'est médiocre et inadmissible pour des pros.le service sur ardoise c 'est bof et la quantité n'est pas au rendez vous. dommage."
92,juin 2017,"5,0","Monsieur Herve et son équipe au top, très commerçants et souriants. Cadre très sympa et propre. Cuisine basse température gérée à la perfection. Possibilité de faire une pétanque afin de continuer l agréable expérience "
93,mai 2017,"1,0","Venus pour partager un bon moment entre amis, l'attente était interminable, le service d'une lenteur et inorganisé, une serveuse pas du tout mais alors pas du tout professionnelle, qui de plus renverse le plateau de digestif sur les convives !
Un patron pas gracieux et encore moins commerçant, des assiettes très peu garnies, une qualité moindre d'une assiette à l'autre ... Je déconseille TRÈS vivement !"
94,avr. 2017,"3,0","Cela fait 3 fois que je viens dans cet établissement. Les expériences sont variées et mon avis reste donc partagé. Les produits sont frais, mais la mise en œuvre est parfois défaillante : Une sauce trop moutardée qui « tue » la saveur des produits d’une salade, un œuf meurette dont la sauce au vin rouge n’est pas assez cuite, un gratin de ravioles trop cuit (pourtant délicieux à la bonne cuisson), une tarte tatin qui n’est pas au niveau requis. C’est dommage, le lieu est agréable, les produits employés sont de qualité et le service est vraiment aux petits oignons pour les clients. Il y a donc du potentiel, mais il est gâché."
95,avr. 2017,"1,0",Je ne fais jamais de commentaires sur TripAdvisor et il ne m'est jamais arrivée de ne pas finir mon assiette au restaurant car moi et mon partenaire somme du métier! Mais la déception de ce soir fu énorme! Salade lyonnaise médiocre œuf poché cassé baignant dans l'eau! Tartare de bœuf et bavette immangeable! Patates sautées noir! Nous ne parlons pas non plus de grande gastronomie! Des basiques terriblement gâchés qui nous ont fait quitter la table au milieu du plat de résistance sans finir nos assiettes! Expérience qui ne m'est jamais arrivée dans le passé ! Une énorme déception au prix salée de 50€! Même si le personnel de cuisine est en période d'apprentissage il est impossible de laisser sortir de production une qualité aussi mauvaise pour les clients! 
96,avr. 2017,"4,0","Produits frais, cadre agréable, cuisine ouverte, gentillesse du personnel.. un moment agréable.. à renouveler !"
97,avr. 2017,"4,0","Le plat du jour était très bon. Seul bémol, la quantité est trop limitée pour les gourmands. La tarte à la praline en dessert était parfaite. Le serveur était très sympathique et souriant. Le service à été très rapide. Une bonne adresse à connaître !"
98,mars 2017,"5,0","Super accueil de la serveuse alors que nous n avions pas réservé 
Des plats cuisinés a la minute. 
Les cuisses de grenouille étaient délicieuses. 
En dessert une poire cuite à basse température avec un coulis de chocolat chaud maison, un vrai régal !!!
Le resto était bien rempli, la serveuse a très bien gérer l'attente par de petits gestes simples. 
Félicitations à cette équipe peu nombreuse mais efficace !!!"
99,NA,"5,0",Une soirée très agréable dans ce petit restau simple et convivial. Et le contenu des assiettes était parfait aussi
100,nov. 2016,"4,0","J'aime beaucoup ce restaurant, prix abordables et du fait maison...Ca n'a plus de prix :) 
Très Bien le midi Quand on est presse ou le soir en famille Ou entre amis!  
J'ai Toujours Bien mange et j'y vais régulièrement. 
"
101,févr. 2017,"3,0","Cuisine de qualité bien servie 
Esprit bistrot 
Addition un peu chère compte tenu de l'esprit bistrot et du cadre moyen pour le soir 
À faire plutôt à midi"
102,févr. 2017,"2,0",Très très déçu par la qualité et la quantité ridicule du tartare de boeuf portion pour un enfant. Le tartare trop assaisonné ...plus aucun goût de la viande .pommes de terre trop cuite ou recuite ? Pour une salade lyonnaise moyenne .un oeufs meurette .des grenouille très fade et mon tartare de boeuf pas bon du tout ..45 euros  .J ai perdus mon argent 
103,juin 2016,"3,0","Ce restaurant ne m'aura pas laissé un souvenir impérissable. J'ai pris une pièce de bœuf qui s'est avéré être un morceau de ""plastic"". J'ai galéré pour la couper d'autant plus que le couteau n'était pas adapté pour du bœuf. La quantité de la garniture accompagnant la viande 🍖 était franchement pas suffisante. Je n'ai pourtant pas un gros appétit mais là je suis restée sur ma faim.
Après je ne sais pas quoi dire si ce n'est que ce restaurant est dans la moyenne."
104,déc. 2016,"4,0",Je vais souvent à l'Esprit Bistrot pour une déjeuner entre amis ou un dîner en amoureux. La cuisine et le service sont très bien. Les produits sont frais et on connait les fournisseurs (locaux).
105,déc. 2016,"3,0","Bonjour, poulet moyen, super dessert en revanche ! L'addition svp. Bonsoir. 

Voila, mon dîner au bistrot avec l'esprist resté en cuisine surement. J'ai teste Et pas approuvé... cela arrive. "
106,déc. 2016,"4,0","Accueil chaleureux, service au top ! Les plats et le vin étaient très bon avec une mention spéciale pour les ravioles aux morilles ..."
107,déc. 2016,"4,0","Cuisine ouverte qui donne une ambiance ""on a rien à cacher"" qui est raccord avec l'approche produits frais.
Repas très bon et joliment présenté.
Comptez 30€ le menu (peut-être un peu cher)"
108,nov. 2016,"3,0","Cadre sympa 
Cuisine correcte , pas tres copieux et certains plats un peu cher .
Petits bemols sur les pommes sautées archi grillées et sur le steak tartare coupé beaucoup trop gros ."
109,oct. 2016,"4,0","Les service est agréable, la cuisine est bonne. La cuisine ouverte sur la salle est une bonne idée mais les odeurs dans la salle, très moyen. On a l'impression de ressortir du restaurant parfumé à l'odeur de cuisine. Dommage...
Il faut alors demander à être dans la 1ère salle ou dehors !"
110,nov. 2016,"4,0","Un petit bistro qui ne paye pas de mine mais un bon rapport qualité/prix avec tout fait maison! 
Il y en a pour tous les goûts et c'est un vrai régale! "
111,nov. 2016,"4,0","Accueil sympathique, service efficace et rapide (un samedi soir à 19H15).
La salle manquait d'un peu de chauffage ...
Produits frais avec mention de la provenance sur la carte.
Le saumon rôti en croûte de tapenade était excellent."
112,nov. 2016,"3,0","Lieu agréable
Service sympathique 
Rapport qualité/prix moyen
Saumon à la tapenade très bon, mais portion très réduite peu de choix d'accompagnement 
Nems aux fruits, un joli nom pour un chausson aux pommes améliorés "
113,nov. 2016,"3,0","L'accueil est bien la salle est sympa le service est minimaliste , 
par exemple vous garder les verres d'apéritif tout le repas.
Les plats sont bons mais les viandes sont en petites quantité par rapport au prix du plat....
Le pire est de sortir de là en empestant le gras.... 
Quelle déception si vous avez un rdv professionnel juste après. ...
"
114,oct. 2016,"2,0","Plats servis tièdes voir froids. 
Vue sur la cuisine négligée. Pleine vue sur le cuisinier qui met ses doigts dans la purée afin de voir si elle est assez chaude.
Les plats ne sont pas servis en même temps. 
Les cafés servis avant les desserts.
La table n'est pas débarrassée entièrement.... 
Bref, malgré un vrai problème d'organisation, le lieu reste agréable, le personnel souriant et bienveillant. "
115,oct. 2016,"5,0","Réservation un samedi soir, pas mal de tables réservées, accueil souriant, cadre agréable, quasiment invisible sur le boulevard, il faut vraiment connaitre. 
Tartare de saumon en entrée (délicieux)/ Os à moelle pour mes amis (extra), tartare de boeuf à l'Italienne en plat (XXL) : Monstrueusement servi (il devait bien y avoir 400g dans l'assiette) et surtout parfaitement assaisonné, j'ai calé direct, tant pis pour le dessert :) Le Saint Joseph était impec (30€ la bouteille), une quarantaine d'euros par personne, vin et apéro compris, c'était plus que raisonnable vu la qualité/quantité dans nos assiettes. On reviendra, c'est sûr."
116,oct. 2016,"5,0","Un restaurant au coeur du 8eme, qui propose une carte totalement fait maison, des entrées aux desserts en passant par les plats et les garnitures !
Et plus que bien cuisinée en plus !
Un vrai régal, des plats bons et sublimes : à recommander !"
117,sept. 2016,"4,0","Simple et efficace pour ce petit repas en semaine autour du saumon (tartare et en croute) arrosé d'un petit macon. Bon service, lieu sympathique. Si on doit trouver un défaut, ce sera l'absence d'assaisonnement de tous les plats et cela c'est dommage."
118,sept. 2016,"4,0","Un repars qui s'est très bien déroulé.
Le seul mini hic c'est la deco de la salle mais rien de bien méchant. 
Le papilles sont heureuses et les yeux le sont tout autant"
119,sept. 2016,"4,0","Très bon restaurant avec des produits frais. Les plats sont faits maison. La salle est agréable et bien décorée. Le personnel est sympathique.
Nous recommandons ce restaurant. C'est la deuxième fois que nous nous y rendons."
120,août 2016,"1,0","très longue attente après prise de la commande,ensuite entre arrive encore gelé a l’intérieur.plat décevante, ma fille étais malade le soir mémé et mon ami aussi.
moi non heureusement,manque les vins sur le carte aussi,tres decu en generale je ne retourneras pas !!"
121,août 2016,"2,0","Nous avons déjeuné à l'esprit bistrot de Garibaldi il y a 2 semaines, et là nous avons renouvelé notre expérience . 
Nous avons apprécié la cuisine, avons choisi le menu à la carte à 29 euros, des produits de qualité, une cuisine simple mais bien préparée .
Le dessert m'a un peu déçu, j'ai choisi  le vacherin avec 2 boules de glace, et on m'a servi ce dessert sans la meringue, remplacé par 2 petits gâteaux au chocolat. C 'est dommage  j'aurais aimé que la serveuse m'informe de  ce changement . Sinon le service est chaleureux et rapide ."
122,août 2016,"4,0","Resto dans un petit coin sympa, avec la possibilité de manger en terrasse. Le serveur, seul en ce week-end du 15 août à assuré. Il prenait les commandes et servait les plats dans des délais appréciables, avec une amabilité sans faille. Des plats sympas (je conseille le gâteau à  la fêta !). Des prix raisonnables (les plats 15-18 euros en moyenne et une formule entrée /plat/dessert 25 euros)"
123,juil. 2016,"1,0","Nous sommes venu régulièrement, la qualité des mets est quasi toujours au rendez vous, mais 3 évènements nous ont échaudés: 
- la carte dite ""de saison"" qui ne change pas...
- la livraison qui n'est finalement jamais possible, donc nous venons chercher. 
- la cerise sur le gâteau lors de notre dernière commande à emporter, la serveuse a refusé de nous faire payer le tarif de la formule car nous étions le soir, et c'est ""réservé"" pour les bureaux et le midi! Ayant déjà récupérer des repas chez eux j'ai été surpris et insisté, et malgré le prospectus à l’appuie la serveuse n'en démordait pas, nous avons donc payé 66 euros au lieu de 43 euros. 

Nous avons l'habitude de laisser des avis positifs, ou pas d'avis quand nous sommes peu satisfaits, mais nous n'avions jamais croisé de restaurateur malhonnête, nous ne reviendrons plus."
124,juil. 2016,"4,0","Nous cherchions un restaurant pour passer une soirée agréable entre amis : nous l'avons trouvé. 
La carte est plutôt simple mais variée, les plats sont copieux et de bonne qualité. 
L'ambiance est agréable et la décoration est sympathique. 
Une adresse à conserver et à conseiller pour des moments conviviaux.
A noter qu'il est possible d'appeler et de commander son repas à emporter."
125,juil. 2016,"3,0","Les produits semblent à la hauteur de la promesse (producteur et fournisseurs identifiés). Les plats sont bons. Le service, c'est compliqué car des samedis soir à 10 couverts, c'est pas simple. Les conseils sont avisés mais avec une trop forte désinvolture, ou jeunesse..."
126,juil. 2016,"4,0","Après un dernier repas décevant en avril, j'y suis retourné ce soir avec l'espoir de retrouver le bon restaurant sympa que je connaissais ! J'ai été ravie et ""repas"" conquise ! La carte d'été est très variée, les plats copieux et bien présentés. Service rapide et efficace. À recommander !"
127,juil. 2016,"2,0","Nous étions 11 personnes venus pour diner.
Oubli d'une boisson après 10 min d'attente
Plats corrects
Desserts : Tiramisu décevant (café retombé au fond donc mousse liquide) et 1 des 4 moelleux chocolat servi sans décoration et la serveuse n'en a rien eu à faire
Attente de 15 min pour payer et la serveuse a lourdement soufflé quand on lui a dit que l'on payait chacun notre commande (elle a eu du mal à faire les comptes, même avec sa calculatrice!)
Elle a également ""pesté"" à haute voix au moment des règlements quand on lui a demandé si il n'y avait pas eu une erreur sur le prix des boissons softs."
128,juil. 2016,"5,0",Nous avons réservé ce restaurant via la fourchette mais il s'agissait de celui de Garibaldi . Les produits sont bons et le service très bien. Il n'y avait pas grand monde mais la terrasse extérieure est sympathique . Pour 3 personnes avec plats + dessert nous avons payés 60€ avec 30% de réduction .rien à reprocher à ce prix là 
129,juil. 2016,"5,0","De passage dans la ville de Lyon, nous avons découvert ce restaurant grâce à la fourchette. Ce fut très bien, très agréable. Le serveur a été très sympathique. Nous avons payé une soixantaine d'euros pour 3 ""plats+deserts"" avec un apero.
je recommande ce restaurant mais avec la réduction la fourchette car sinon nous trouvions le prix un peu élevé."
130,mai 2016,"5,0","Nous sommes déjà allés manger à ce restaurant 4 fois (3 fois en couple et une fois avec mes beaux - parents) et on n'a jamais déçus ! Les plats sont très bons et faits à base de produits locaux (la plupart de leurs fournisseurs/partenaires sont d'ailleurs mentionnés sur leur carte). Le cadre est sympa à l'intérieur mais leur terrasse est petite et en bord de route (même s'il s'agit d'une route peu fréquentée), c'est pourquoi nous préférons y aller en automne / hiver ou alors les jours de pluie ou pas très chauds en printemps / été."
131,juin 2016,"2,0","Cinq amies un soir d'orage à Lyon moyenne d'âge 60 et plus donc assez averties sur le goût des bonnes choses !
L'accueil nul nous avions réservé la petite serveuse est débordée...
Menus du soir à 25 et 29 euros ou carte 
Nous commandons des plats qui semblent simples, pour ma part je choisis du canard façon tajine et qui arrive avec une sauce brunâtre et un petit récipient sauteuse de frites !! Pommes de terre coupées en petits cubes gorgées d'huile, une amie réclame des légumes la serveuse amène une coupelle de lamelles de poivrons très gras également...
Pas de pain à l'horizon, on s'en passera...
Dessert glacé sorbet je choisis un vacherin et me retrouve avec une meringuette et des boules de sorbet arrosés d'une sauce très sucrée brun roux.
On ose demander à la serveuse de prendre quelques photos souvenirs merci à elle.
L'addition se règle à la sortie derrière un comptoir de bar.
Il fait orage dehors peu importe l'orage est dans l'estomac jusqu'à ce matin. Merci à Citrate de Bétaïne 
Pour ma part je n'y reviendrai pas, l'amie qui avait retenu ce restau avait pourtant lu de bonnes critiques .... Je ne comprends pas"
132,juin 2016,"1,0","Je suis très déçue par cet établissement tant pour la cuisine steak tartare avec une viande dure et nerveuse coupée très grossièrement au couteau. Supplément de 2€ pour l'assaisonnement japonais inexistant mais il faut remarquer que même les frites et les salades ne sont pas bonnes.
Les desserts ""re visités"" café liégeois servi dans l'assiette avec une glace immangeable car avec des morceaux qui pouvaient être de toute origine sauf des grains de café.. Vacherin microscopique etc.
Enfin les couverts ne sont pas propres et j'ai des doutes sur la tenue de la cuisine pour ce que j'en ai vu car elle est ouverte, ce qui nous a d'ailleurs aussi permis d'être enfumé toute la soirée. Je souhaite aussi parler du service qui est en dessous de tout et en tous cas absolument pas professionnel.
Bref un établissement que pour ma part je ne recommande pas."
133,juin 2016,"4,0","Très sympa avec des produits locaux (en vente sur place d'ailleurs). Une carte assez serrée mais bien variée. Rapport qualité/prix correct. Compter 15€ pour un plat.
Terrasse ombragée très agréable un peu en retrait de la place Ambroise Courtois."
134,mars 2016,"4,0",".. une vraie bonne adresse du 8ème arrondissement ..cadre sympathique,  produits frais et carte qui évolue régulièrement.. service efficace.. seul bémol, le prix du vin, un peu cher pour les qualités proposées.."
135,févr. 2016,"1,0","Ma pire expérience dans un resto, et de très loin!! J'avais pris une salade de cromesquis (14€): résultat 9 minuscules (vraiment minuscules) trucs liquides au goût de miel (et un peu de chèvre), sur de la salade en sachet, une vraie honte pour le prix!!!! J'ai préféré ne pas prendre de dessert, et heureusement: les coulis des desserts de mes collègues n'étaient clairement plus du tout mangeables (j'ai moi-même gouté, goût absolument infecte, elles n'ont donc pas terminé).
Certaines de mes collègues ont du se lever pour avoir une seconde bière et pas besoin de nous demander la note elle a très rapidement été apportée. Service désagréable qui plus est.
Je ne sais pas si c'est le patron ou un employé essayant de faire couler le restau qui nous a servi, mais cette personne devrait changer de métier.
Vraiment lamentable, dégueulasse, une honte......!!!!!"
136,mai 2016,"4,0","Très sympa carteassez variée et possibilité d'acheter des produits sur place : vin, saumon... Produits de qualité et frais."
137,avr. 2016,"1,0","Nous étions 8 à dîner le serveur ( pas très gracieux ) a déjà oublié mon apéritif . Passons ca arrive à tous le monde . Bref nous commandant il est incapable de nous dire l entre du jour bref ça peut arrivé . Un ami prend l os à moelle très belle présentation je l avoue mais l os à moelle été encore cru à l intérieur nous le renvoyons en cuisson il nous reviens encore cru . Nous ne voulons pas faire d histoire nous disons rien et au passage le serveur nous pose pas la question quoi il ne l avais pas fini . Passons . Je pends un magrets de canards sauce tonka sauf erreur de ma pars ca à un goût un peux chocolaté la on ce retrouve avec une sauce au poivre avec un magrets archi cuits je le signal au serveur qui en a strictement rien à faire . Pars la suite nous prenons des desserts dont un moelleux au chocolat le serveur nous demande la sauce que nous souhaitons on lui réponds fruits rouge il nous ramène une sauce au chocolat !!!!!! 
Bref restaurant où je ne retournerai pas et ne conseillerai pas surtout pour un restaurant qui ce dit maître restaurateur  "
138,févr. 2016,"4,0","J'ai eu l’occasion de le tester 2 fois avec très peu d'intervalle.Le menu du midi à 18,50 tient vraiment bien la route car les plats sont bons et bien servis et la qualité des produits sont là avec un bon service.A tester le soir."
139,avr. 2016,"4,0","bistrot c'est ce qui domine dans cet établissement.
L'accueil,le service,la cuisine tout est dans l'esprit bistrot.
Consommateur attention je trouve les vins assez chers..."
140,sept. 2015,"4,0","Il s'agit d'un bon restaurant - prix moyennement élevé mais cuisine de qualité. quantités peut être insuffisantes 
À refaire "
141,mars 2016,"4,0",Réservation directement sur le site 30% de réduction sur entrée plat et dessert prix à la carte. Pas trop de plats juste ce qu'il faut. Excellente qualité des produits par rapport au  prix. Déco sympa. Je conseille. 
142,mars 2016,"4,0","Très bonne adresse, 3 jeunes en salle cuistot compris, vite servi, qualité des produits TB, rien à reprocher, vin au pot très bien, très bonne adresse dans le quartier Monplaisir, on reviendra!!!"
